{
  "version": 1,
  "name": "US County Unemployment",
  "nodes": [
    {
      "id": "deck",
      "op": "deck",
      "name": "deck",
      "x": 1454,
      "y": 119,
      "params": {
        "mapStyle": "https://basemaps.cartocdn.com/gl/voyager-gl-style/style.json",
        "projection": "mercator",
        "longitude": -94.347,
        "latitude": 40.017,
        "zoom": 5.45,
        "pitch": 0,
        "bearing": 0,
        "display": "fixed",
        "width": 1920,
        "height": 1080,
        "lod": 2,
        "scaleMode": "fit",
        "waitForData": true,
        "codec": "avc",
        "bitrateMbps": 10,
        "bitrateMode": "constant",
        "scaleControl": 0.3,
        "framerate": 30,
        "captureDelay": 50,
        "rendersDirectory": "renders"
      }
    },
    {
      "id": "data-source",
      "op": "geojson",
      "name": "data-source",
      "x": 0,
      "y": 163,
      "params": {
        "url": "@/data.geojson"
      }
    },
    {
      "id": "extent",
      "op": "extent",
      "name": "extent",
      "x": 340,
      "y": 292,
      "params": {
        "input": "coalesce(unemployment_rate, 0)"
      }
    },
    {
      "id": "geojson-layer",
      "op": "polygon",
      "name": "geojson-layer",
      "x": 1184,
      "y": 49,
      "params": {
        "opacity": 0.8,
        "blend": "normal",
        "position": "geom",
        "color": "unemployment_color",
        "lineColorChannel": "",
        "lineColor": [
          0,
          0,
          0
        ],
        "filled": true,
        "stroked": false,
        "lineWidthScale": 1,
        "lineWidthUnits": "meters",
        "lineWidthMinPixels": 0,
        "extruded": false,
        "elevation": "",
        "elevationScale": 1000
      }
    },
    {
      "id": "geojson-layer-lines",
      "op": "path",
      "name": "geojson-layer-lines",
      "x": 1184,
      "y": 155,
      "params": {
        "opacity": 0.8,
        "blend": "normal",
        "position": "geom",
        "color": "",
        "lineColor": [
          0,
          0,
          0
        ],
        "widthScale": 1,
        "widthUnits": "meters",
        "widthMinPixels": 0
      }
    },
    {
      "id": "geojson-layer-points",
      "op": "scatter",
      "name": "geojson-layer-points",
      "x": 1184,
      "y": 261,
      "params": {
        "opacity": 0.8,
        "blend": "normal",
        "position": "geom",
        "color": "unemployment_color",
        "radius": "",
        "radiusScale": 1,
        "radiusUnits": "meters"
      }
    },
    {
      "id": "unemployment",
      "op": "attribute",
      "name": "unemployment",
      "x": 340,
      "y": 0,
      "params": {
        "name": "unemployment",
        "expression": "coalesce(unemployment_rate, 0)"
      }
    },
    {
      "id": "map-range",
      "op": "map-range",
      "name": "map-range",
      "x": 713,
      "y": 146,
      "params": {
        "input": "unemployment",
        "name": "map_range",
        "kind": "linear",
        "clamp": false,
        "inMin": 0.1,
        "outMin": 0,
        "outMax": 1
      }
    },
    {
      "id": "unemployment-color",
      "op": "color-ramp",
      "name": "unemployment-color",
      "x": 926,
      "y": 155,
      "params": {
        "input": "map_range",
        "ramp": "viridis",
        "min": 0,
        "max": 1,
        "name": "unemployment_color"
      }
    },
    {
      "id": "data-note",
      "op": "comment",
      "name": "data-note",
      "x": 0,
      "y": 75,
      "params": {
        "text": "This loads every US county with its unemployment rate and labor force.",
        "width": 300,
        "height": 80
      }
    },
    {
      "id": "extent-note",
      "op": "comment",
      "name": "extent-note",
      "x": 340,
      "y": 106,
      "params": {
        "text": "This finds the highest rate, so the colors cover the full range from low to high.",
        "width": 300,
        "height": 80
      }
    },
    {
      "id": "rate-note",
      "op": "comment",
      "name": "rate-note",
      "x": 340,
      "y": 194,
      "params": {
        "text": "unemployment reads each county's rate. Change unemployment_rate to labor_force in Expression to map workforce size instead.",
        "width": 333,
        "height": 90
      }
    },
    {
      "id": "try-next-note",
      "op": "comment",
      "name": "try-next-note",
      "x": 1644,
      "y": 113,
      "params": {
        "text": "Try next:\n- Click unemployment-color and pick a different Ramp.\n- Click geojson-layer and turn on Outline to outline each county.\n- Press Export and pick Image (PNG) to save the map.",
        "width": 340,
        "height": 170
      }
    }
  ],
  "edges": [
    {
      "id": "data-source.features->extent.in",
      "source": "data-source",
      "sourcePort": "features",
      "target": "extent",
      "targetPort": "in"
    },
    {
      "id": "extent.max->map-range.par:inMax",
      "source": "extent",
      "sourcePort": "max",
      "target": "map-range",
      "targetPort": "par:inMax"
    },
    {
      "id": "geojson-layer.out->deck.layers",
      "source": "geojson-layer",
      "sourcePort": "out",
      "target": "deck",
      "targetPort": "layers",
      "index": 0
    },
    {
      "id": "geojson-layer-lines.out->deck.layers.1",
      "source": "geojson-layer-lines",
      "sourcePort": "out",
      "target": "deck",
      "targetPort": "layers",
      "index": 1
    },
    {
      "id": "geojson-layer-points.out->deck.layers.2",
      "source": "geojson-layer-points",
      "sourcePort": "out",
      "target": "deck",
      "targetPort": "layers",
      "index": 2
    },
    {
      "id": "data-source.features->unemployment.in",
      "source": "data-source",
      "sourcePort": "features",
      "target": "unemployment",
      "targetPort": "in"
    },
    {
      "id": "unemployment.out->map-range.in",
      "source": "unemployment",
      "sourcePort": "out",
      "target": "map-range",
      "targetPort": "in"
    },
    {
      "id": "map-range.out->unemployment-color.in",
      "source": "map-range",
      "sourcePort": "out",
      "target": "unemployment-color",
      "targetPort": "in"
    },
    {
      "id": "unemployment-color.out->geojson-layer.in",
      "source": "unemployment-color",
      "sourcePort": "out",
      "target": "geojson-layer",
      "targetPort": "in"
    },
    {
      "id": "unemployment-color.out->geojson-layer-lines.in",
      "source": "unemployment-color",
      "sourcePort": "out",
      "target": "geojson-layer-lines",
      "targetPort": "in"
    },
    {
      "id": "unemployment-color.out->geojson-layer-points.in",
      "source": "unemployment-color",
      "sourcePort": "out",
      "target": "geojson-layer-points",
      "targetPort": "in"
    }
  ]
}
